,point_id,score,point,case,quoteDoc,quoteText
0,17128,50,neutral,There is a date of the last update of the agreements,Terms of Service,"This Terms of Use Agreement was last updated on January 30, 2012.<br>"
1,17130,40,bad,You are solely responsible for claims made against the service and agree to indemnify and hold harmless the service.,Terms of Service,"Member agrees to indemnify and hold BaronsMedia.com LLC, its parents, subsidiaries, affiliates, officers and employees, harmless from any claim or demand, including reasonable attorneys’ fees and costs, made by any third party due to or arising out of Member’s use of the Service, the violation of this Agreement, or infringement by Member, or other user of the Service using Member’s computer, of any intellectual property or any other right of any person or entity.<br>"
2,17132,50,neutral,This service assumes no responsibility and liability for the contents of links to other websites,Terms of Service,"Our website may include links to other sites on the Internet that are owned and operated by online merchants and other third parties.
You acknowledge that we are not responsible for the availability of, or the content located on or through, any third-party site."
3,17135,10,neutral,Invalidity of any portion of the Terms of Service does not entail invalidity of its remainder,Terms of Service,"If any provision of this Terms of Use Agreement shall be unlawful, void or unenforceable for any reason, the other provisions (and any partially-enforceable provision) shall not be affected thereby and shall remain valid and enforceable to the maximum possible extent"
