,point_id,score,point,case,quoteDoc,quoteText
0,8455,10,bad,Third-party cookies are used for statistics,Policy on Cookies and Similar Technologies,"Third-party such as advertising networks and providers of external services like web traffic analysis may use cookies, web beacons, software development kits (SDKs) or similar technologies to collect information about your visit to our Platform.
The information is used to provide you with more relevant advertising on our Platform or elsewhere on the Internet.
We do not have control over the use of these third-party cookies, which are governed by those third-parties’ privacy/cookies policies"
1,8456,50,neutral,"You should revisit the terms periodically, although in case of material changes, the service will notify",Terms of Use,"We reserve the right to change these Terms from time to time, and at our sole discretion.
We may send you a notice regarding material changes to these Terms, including the Privacy Policy or the Platform.
You should make note of the ""last updated date"" at the beginning of the Terms.
With this information, you should be able to identify if the Terms have been updated recently.</p>"
2,8458,50,bad,This service reserves the right to disclose your personal information without notifying you,Privacy Policy,"We may disclose your personal data to law enforcement authorities, regulators, governmental or public bodies and other relevant third parties to comply with any legal or regulatory requirements."
3,8459,60,bad,Your account can be deleted without prior notice and without a reason,Terms of Use,"You acknowledge and agree that OLX, in its sole and absolute discretion, has the right (but not the obligation) to delete or deactivate your account, block your e-mail or IP address, or otherwise terminate your access to or use of the Service (or any part thereof), immediately and without notice"
4,8460,50,blocker,Specific content can be deleted without reason and may be removed without prior notice,Terms of Use,"remove and discard any Content within the Service, for any reason or no reason at all, including, without limitation, if OLX believes that you have violated these Terms."
5,8461,50,neutral,There is a date of the last update of the agreements,Terms of Use,THESE TERMS OF USE WERE UPDATED ON FEBRUARY 11TH 2019
