,point_id,score,point,case,quoteDoc,quoteText
0,11061,50,neutral,There is a date of the last update of the agreements,EVE Online - Terms of Service,"REVISED: 9 September, 2013"
1,11062,15,neutral,This service is only available to users over a certain age,EVE Online - Terms of Service,"In compliance with The Children’s Online Privacy Act of April, 2000, we cannot provide subscriptions to individuals under the age of 13.
If you are under the age of 13, you may not create an EVE Online account and you are not eligible to enter contests or promotions."
2,11063,25,bad,You shall not interfere with another person's enjoyment of the service,EVE Online - Terms of Service,You may not do anything that interferes with the ability of other EVE Online subscribers to enjoy the game or web site in accordance with its rules.
3,11064,60,bad,Your account can be deleted without prior notice and without a reason,EVE Online - Terms of Service,"CCP reserves the right to close, temporarily or permanently, any user’s account without advance notice as we deem necessary."
